{
  "api_surface": {
    "classes": {
      "::": {
        "fields": [],
        "libraries": [
          "package:workmanager/src/workmanager.dart",
          "package:workmanager/workmanager.dart"
        ],
        "methods": [],
        "types": []
      },
      "BackoffPolicy": {
        "fields": [
          "exponential",
          "linear"
        ],
        "libraries": [
          "package:workmanager/src/options.dart",
          "package:workmanager/workmanager.dart"
        ],
        "methods": [],
        "types": []
      },
      "Constraints": {
        "fields": [
          "networkType",
          "requiresBatteryNotLow",
          "requiresCharging",
          "requiresDeviceIdle",
          "requiresStorageNotLow"
        ],
        "libraries": [
          "package:workmanager/src/options.dart",
          "package:workmanager/workmanager.dart"
        ],
        "methods": [
          "Constraints"
        ],
        "types": [
          "NetworkType"
        ]
      },
      "ExistingWorkPolicy": {
        "fields": [
          "append",
          "keep",
          "replace"
        ],
        "libraries": [
          "package:workmanager/src/options.dart",
          "package:workmanager/workmanager.dart"
        ],
        "methods": [],
        "types": []
      },
      "JsonMapperHelper": {
        "fields": [],
        "libraries": [
          "package:workmanager/src/workmanager.dart"
        ],
        "methods": [
          "toInitializeMethodArgument",
          "toRegisterMethodArgument"
        ],
        "types": [
          "BackoffPolicy",
          "Constraints",
          "ExistingWorkPolicy"
        ]
      },
      "NetworkType": {
        "fields": [
          "connected",
          "metered",
          "not_required",
          "not_roaming",
          "unmetered"
        ],
        "libraries": [
          "package:workmanager/src/options.dart",
          "package:workmanager/workmanager.dart"
        ],
        "methods": [],
        "types": []
      },
      "Workmanager": {
        "fields": [
          "iOSBackgroundProcessingTask",
          "iOSBackgroundTask"
        ],
        "libraries": [
          "package:workmanager/src/workmanager.dart",
          "package:workmanager/workmanager.dart"
        ],
        "methods": [
          "Workmanager",
          "cancelAll",
          "cancelByTag",
          "cancelByUniqueName",
          "executeTask",
          "initialize",
          "registerOneOffTask",
          "registerPeriodicTask"
        ],
        "types": [
          "BackoffPolicy",
          "Constraints",
          "ExistingWorkPolicy",
          "Workmanager"
        ]
      }
    }
  },
  "collected_at": "2026-06-11T09:26:00Z",
  "package": "workmanager",
  "pubdb_schema_version": 1,
  "source_fingerprint": {
    "basic_message_channels": [],
    "const_classes": [],
    "digest": "b6a35e6fc447e795529f3363c4328c95df18db5a0515beb72446bb2516398df2",
    "event_channels": [],
    "ffi_symbols": [],
    "hierarchy_hash": "1e0790fa15260733d8715490e3acb805f7a220e7456fa299dcd8b0c7820fc83e",
    "method_channels": [
      "be.tramckrijte.workmanager/background_channel_work_manager",
      "be.tramckrijte.workmanager/foreground_channel_work_manager"
    ],
    "strategy": "source-structural-v1",
    "string_literals": [
      ".",
      "The callbackDispatcher needs to be either a static function or a top level function to be accessible as a Flutter entry point.",
      "backgroundChannelInitialized",
      "backoffDelayInMilliseconds",
      "backoffPolicyType",
      "be.tramckrijte.workmanager.DART_TASK",
      "be.tramckrijte.workmanager.INPUT_DATA",
      "be.tramckrijte.workmanager/background_channel_work_manager",
      "be.tramckrijte.workmanager/foreground_channel_work_manager",
      "callbackHandle",
      "cancelAllTasks",
      "cancelTaskByTag",
      "cancelTaskByUniqueName",
      "dart:async",
      "dart:convert",
      "dart:ui",
      "existingWorkPolicy",
      "frequency",
      "iOSPerformFetch",
      "initialDelaySeconds",
      "initialize",
      "inputData",
      "isInDebugMode",
      "networkType",
      "options.dart",
      "package:flutter/services.dart",
      "package:flutter/widgets.dart",
      "registerOneOffTask",
      "registerPeriodicTask",
      "requiresBatteryNotLow",
      "requiresCharging",
      "requiresDeviceIdle",
      "requiresStorageNotLow",
      "src/options.dart",
      "src/workmanager.dart",
      "tag",
      "taskName",
      "uniqueName",
      "workmanager.background.task"
    ]
  },
  "version": "0.5.0-dev.2"
}
