{
  "api_surface": {
    "classes": {
      "ColorizeAnimatedTextKit": {
        "fields": [
          "colors",
          "duration",
          "text",
          "textStyle"
        ],
        "libraries": [
          "package:animated_text_kit/animated_text_kit.dart",
          "package:animated_text_kit/src/colorize.dart"
        ],
        "methods": [
          "ColorizeAnimatedTextKit",
          "createState"
        ],
        "types": []
      },
      "FadeAnimatedTextKit": {
        "fields": [
          "duration",
          "text",
          "textStyle"
        ],
        "libraries": [
          "package:animated_text_kit/animated_text_kit.dart",
          "package:animated_text_kit/src/fade.dart"
        ],
        "methods": [
          "FadeAnimatedTextKit",
          "createState"
        ],
        "types": []
      },
      "RotateAnimatedTextKit": {
        "fields": [
          "duration",
          "text",
          "textStyle",
          "transitionHeight"
        ],
        "libraries": [
          "package:animated_text_kit/animated_text_kit.dart",
          "package:animated_text_kit/src/rotate.dart"
        ],
        "methods": [
          "RotateAnimatedTextKit",
          "createState"
        ],
        "types": []
      },
      "ScaleAnimatedTextKit": {
        "fields": [
          "duration",
          "scalingFactor",
          "text",
          "textStyle"
        ],
        "libraries": [
          "package:animated_text_kit/animated_text_kit.dart",
          "package:animated_text_kit/src/scale.dart"
        ],
        "methods": [
          "ScaleAnimatedTextKit",
          "createState"
        ],
        "types": []
      },
      "TyperAnimatedTextKit": {
        "fields": [
          "duration",
          "text",
          "textStyle"
        ],
        "libraries": [
          "package:animated_text_kit/animated_text_kit.dart",
          "package:animated_text_kit/src/typer.dart"
        ],
        "methods": [
          "TyperAnimatedTextKit",
          "createState"
        ],
        "types": []
      },
      "TypewriterAnimatedTextKit": {
        "fields": [
          "duration",
          "text",
          "textStyle"
        ],
        "libraries": [
          "package:animated_text_kit/animated_text_kit.dart",
          "package:animated_text_kit/src/typewriter.dart"
        ],
        "methods": [
          "TypewriterAnimatedTextKit",
          "createState"
        ],
        "types": []
      }
    }
  },
  "collected_at": "2026-06-10T19:42:22Z",
  "package": "animated_text_kit",
  "pubdb_schema_version": 1,
  "source_fingerprint": {
    "basic_message_channels": [],
    "const_classes": [
      "ColorizeAnimatedTextKit",
      "FadeAnimatedTextKit",
      "RotateAnimatedTextKit",
      "ScaleAnimatedTextKit",
      "TyperAnimatedTextKit"
    ],
    "digest": "92b1b76ecbdd9ac9c31d6292e8b4bdf2f7c5034c5dbe82e5b10126bac55b251b",
    "event_channels": [],
    "ffi_symbols": [],
    "hierarchy_hash": "55b133d40a6639858f9535a6be4337554d95f00ac24747ebdf2b4d34859bbb3c",
    "method_channels": [],
    "strategy": "source-structural-v1",
    "string_literals": [
      "",
      "_",
      "package:flutter/material.dart",
      "src/colorize.dart",
      "src/fade.dart",
      "src/rotate.dart",
      "src/scale.dart",
      "src/typer.dart",
      "src/typewriter.dart"
    ]
  },
  "version": "1.0.3"
}
