{
  "api_surface": {
    "classes": {
      "::": {
        "fields": [
          "bitsPerByte",
          "bytesPerWord",
          "mask32",
          "md5",
          "sha1",
          "sha224",
          "sha256",
          "sha384",
          "sha512"
        ],
        "libraries": [
          "package:crypto/crypto.dart",
          "package:crypto/src/md5.dart",
          "package:crypto/src/sha1.dart",
          "package:crypto/src/sha256.dart",
          "package:crypto/src/sha512.dart",
          "package:crypto/src/utils.dart"
        ],
        "methods": [
          "add32",
          "rotl32"
        ],
        "types": []
      },
      "Digest": {
        "fields": [
          "bytes",
          "get:hashCode"
        ],
        "libraries": [
          "package:crypto/crypto.dart",
          "package:crypto/src/digest.dart"
        ],
        "methods": [
          "==",
          "Digest",
          "toString"
        ],
        "types": []
      },
      "DigestSink": {
        "fields": [
          "get:value"
        ],
        "libraries": [
          "package:crypto/src/digest_sink.dart"
        ],
        "methods": [
          "add",
          "close"
        ],
        "types": [
          "Digest"
        ]
      },
      "Hash": {
        "fields": [
          "get:blockSize"
        ],
        "libraries": [
          "package:crypto/crypto.dart",
          "package:crypto/src/hash.dart"
        ],
        "methods": [
          "Hash",
          "convert",
          "startChunkedConversion"
        ],
        "types": [
          "Digest"
        ]
      },
      "HashSink": {
        "fields": [
          "get:digest"
        ],
        "libraries": [
          "package:crypto/src/hash_sink.dart"
        ],
        "methods": [
          "HashSink",
          "add",
          "close",
          "updateHash"
        ],
        "types": [
          "Digest"
        ]
      },
      "Hmac": {
        "fields": [],
        "libraries": [
          "package:crypto/crypto.dart",
          "package:crypto/src/hmac.dart"
        ],
        "methods": [
          "Hmac",
          "convert",
          "startChunkedConversion"
        ],
        "types": [
          "Digest",
          "Hash"
        ]
      },
      "MD5": {
        "fields": [
          "blockSize"
        ],
        "libraries": [
          "package:crypto/crypto.dart",
          "package:crypto/src/md5.dart"
        ],
        "methods": [
          "startChunkedConversion"
        ],
        "types": [
          "Digest",
          "Hash"
        ]
      },
      "Sha1": {
        "fields": [
          "blockSize"
        ],
        "libraries": [
          "package:crypto/crypto.dart",
          "package:crypto/src/sha1.dart"
        ],
        "methods": [
          "startChunkedConversion"
        ],
        "types": [
          "Digest",
          "Hash"
        ]
      },
      "Sha224": {
        "fields": [
          "blockSize"
        ],
        "libraries": [
          "package:crypto/crypto.dart",
          "package:crypto/src/sha256.dart"
        ],
        "methods": [
          "newInstance",
          "startChunkedConversion"
        ],
        "types": [
          "Digest",
          "Hash",
          "Sha224"
        ]
      },
      "Sha256": {
        "fields": [
          "blockSize"
        ],
        "libraries": [
          "package:crypto/crypto.dart",
          "package:crypto/src/sha256.dart"
        ],
        "methods": [
          "newInstance",
          "startChunkedConversion"
        ],
        "types": [
          "Digest",
          "Hash",
          "Sha256"
        ]
      },
      "Sha384": {
        "fields": [
          "blockSize"
        ],
        "libraries": [
          "package:crypto/crypto.dart",
          "package:crypto/src/sha512.dart"
        ],
        "methods": [
          "newInstance",
          "startChunkedConversion"
        ],
        "types": [
          "Digest",
          "Hash",
          "Sha384"
        ]
      },
      "Sha384Sink": {
        "fields": [
          "digestBytes"
        ],
        "libraries": [
          "package:crypto/src/sha512_fastsinks.dart",
          "package:crypto/src/sha512_slowsinks.dart"
        ],
        "methods": [
          "Sha384Sink"
        ],
        "types": [
          "Digest"
        ]
      },
      "Sha512": {
        "fields": [],
        "libraries": [
          "package:crypto/crypto.dart",
          "package:crypto/src/sha512.dart"
        ],
        "methods": [
          "newInstance",
          "startChunkedConversion"
        ],
        "types": [
          "Digest",
          "Sha384",
          "Sha512"
        ]
      },
      "Sha512Sink": {
        "fields": [
          "digestBytes"
        ],
        "libraries": [
          "package:crypto/src/sha512_fastsinks.dart",
          "package:crypto/src/sha512_slowsinks.dart"
        ],
        "methods": [
          "Sha512Sink"
        ],
        "types": [
          "Digest"
        ]
      }
    }
  },
  "collected_at": "2026-06-11T07:16:44Z",
  "package": "crypto",
  "pubdb_schema_version": 1,
  "source_fingerprint": {
    "basic_message_channels": [],
    "const_classes": [
      "Hash"
    ],
    "digest": "42ebf41a721cfa38bacfc8437d61e8fd157105e0348cbb6ade661522aae97835",
    "event_channels": [],
    "ffi_symbols": [],
    "hierarchy_hash": "ba8ab768eef6436b3b0fb90b881ff406e90df81c2b67477c609f56a8200d812d",
    "method_channels": [],
    "strategy": "source-structural-v1",
    "string_literals": [
      "HMAC is closed",
      "Hash.add() called after close().",
      "Hashing is unsupported for messages with more than 2^53 bits.",
      "dart:convert",
      "dart:typed_data",
      "digest.dart",
      "digest_sink.dart",
      "hash.dart",
      "hash_sink.dart",
      "package:collection/collection.dart",
      "package:convert/convert.dart",
      "package:typed_data/typed_data.dart",
      "sha512_fastsinks.dart",
      "sha512_slowsinks.dart",
      "src/digest.dart",
      "src/hash.dart",
      "src/hmac.dart",
      "src/md5.dart",
      "src/sha1.dart",
      "src/sha256.dart",
      "src/sha512.dart",
      "utils.dart"
    ]
  },
  "version": "2.1.1+1"
}
