{
  "api_surface": {
    "classes": {
      "::": {
        "fields": [],
        "libraries": [
          "package:shelf/shelf.dart",
          "package:shelf/shelf_io.dart",
          "package:shelf/src/handler.dart",
          "package:shelf/src/handlers/logger.dart",
          "package:shelf/src/middleware.dart",
          "package:shelf/src/util.dart"
        ],
        "methods": [
          "createMiddleware",
          "formatHttpDate",
          "handleRequest",
          "logRequests",
          "parseHttpDate",
          "serve",
          "serveRequests",
          "syncFuture"
        ],
        "types": [
          "Request"
        ]
      },
      "MediaType": {
        "fields": [
          "get:mimeType",
          "parameters",
          "subtype",
          "type"
        ],
        "libraries": [
          "package:shelf/src/media_type.dart"
        ],
        "methods": [
          "MediaType",
          "change",
          "parse",
          "toString"
        ],
        "types": [
          "MediaType"
        ]
      },
      "Message": {
        "fields": [
          "get:contentLength",
          "get:encoding",
          "get:mimeType",
          "headers"
        ],
        "libraries": [
          "package:shelf/src/message.dart"
        ],
        "methods": [
          "Message",
          "read",
          "readAsString"
        ],
        "types": [
          "MediaType"
        ]
      },
      "Request": {
        "fields": [
          "get:ifModifiedSince",
          "get:pathSegments",
          "method",
          "pathInfo",
          "protocolVersion",
          "queryString",
          "requestedUri",
          "scriptName"
        ],
        "libraries": [
          "package:shelf/shelf.dart",
          "package:shelf/src/request.dart"
        ],
        "methods": [
          "Request"
        ],
        "types": [
          "Message"
        ]
      },
      "Response": {
        "fields": [
          "get:expires",
          "get:lastModified",
          "statusCode"
        ],
        "libraries": [
          "package:shelf/shelf.dart",
          "package:shelf/src/response.dart"
        ],
        "methods": [
          "Response",
          "forbidden",
          "found",
          "internalServerError",
          "movedPermanently",
          "notFound",
          "notModified",
          "ok",
          "seeOther"
        ],
        "types": [
          "Message"
        ]
      },
      "Stack": {
        "fields": [
          "get:middleware"
        ],
        "libraries": [
          "package:shelf/shelf.dart",
          "package:shelf/src/stack.dart"
        ],
        "methods": [
          "Stack",
          "addHandler",
          "addMiddleware"
        ],
        "types": [
          "Stack"
        ]
      },
      "StringScanner": {
        "fields": [
          "get:isDone",
          "get:lastMatch",
          "get:position",
          "get:rest",
          "set:position",
          "string"
        ],
        "libraries": [
          "package:shelf/src/string_scanner.dart"
        ],
        "methods": [
          "StringScanner",
          "expect",
          "matches",
          "scan"
        ],
        "types": []
      }
    }
  },
  "collected_at": "2026-06-11T09:04:08Z",
  "package": "shelf",
  "pubdb_schema_version": 1,
  "source_fingerprint": {
    "basic_message_channels": [],
    "const_classes": [
      "Stack"
    ],
    "digest": "24d56ef99f4a17dc45446c2767084aa23e639a91946175227572da9e23c75e63",
    "event_channels": [],
    "ffi_symbols": [],
    "hierarchy_hash": "66af1acdfb83999772424a9434e25f1d0799a51c9f27645c5a5000af32ffddc4",
    "method_channels": [],
    "strategy": "source-structural-v1",
    "string_literals": [
      "",
      " ",
      " 0",
      " GMT",
      "\"",
      "\"(?:[^\"\\x00-\\x1F\\x7F]|\\\\.)*\"",
      "(?:\\r\\n)?[ \\t]+",
      ",",
      ", ",
      "-",
      "../middleware.dart",
      "../util.dart",
      "/",
      ":",
      ":0",
      ";",
      "=",
      "Apr",
      "Aug",
      "Dec",
      "Feb",
      "Fri",
      "Internal Server Error",
      "Jan",
      "Jan|Feb|Mar|Apr|May|Jun|Jul|Aug|Sep|Oct|Nov|Dec",
      "Jul",
      "Jun",
      "Mar",
      "May",
      "Mon",
      "Monday|Tuesday|Wednesday|Thursday|Friday|Saturday|Sunday",
      "Mon|Tue|Wed|Thu|Fri|Sat|Sun",
      "Nov",
      "Oct",
      "Sat",
      "Sep",
      "Sun",
      "Thu",
      "Tue",
      "Wed",
      "You may not pass both [subtype] and [mimeType].",
      "You may not pass both [type] and [mimeType].",
      "[\"\\x00-\\x1F\\x7F]",
      "[()<>@,;:\"\\\\/\\[\\]?={} \\t\\x00-\\x1F\\x7F]",
      "[^()<>@,;:\"\\\\/[\\]?={} \\t\\x00-\\x1F\\x7F]+",
      "\\",
      "\\\\(.)",
      "\\d+",
      "charset",
      "content-length",
      "content-type",
      "dart:async",
      "dart:collection",
      "dart:convert",
      "dart:io",
      "date",
      "expires",
      "handler.dart",
      "if-modified-since",
      "last-modified",
      "location",
      "media_type.dart",
      "message.dart",
      "method cannot be empty.",
      "middleware.dart",
      "null response from handler",
      "package:collection/collection.dart",
      "package:collection/wrappers.dart",
      "package:path/path.dart",
      "package:stack_trace/stack_trace.dart",
      "pathInfo must be empty or start with \"/\".",
      "request.dart",
      "response.dart",
      "scriptName and pathInfo cannot both be empty.",
      "scriptName can never be \"/\". It should be empty instead.",
      "scriptName must be empty or start with \"/\".",
      "scriptName must not end with \"/\".",
      "shelf",
      "shelf.dart",
      "src/handler.dart",
      "src/handlers/logger.dart",
      "src/middleware.dart",
      "src/request.dart",
      "src/response.dart",
      "src/stack.dart",
      "src/util.dart",
      "string_scanner.dart",
      "text/plain",
      "util.dart"
    ]
  },
  "version": "0.3.0+1"
}
