{
  "api_surface": {
    "classes": {
      "::": {
        "fields": [],
        "libraries": [
          "package:video_player/video_player.dart"
        ],
        "methods": [],
        "types": []
      },
      "Caption": {
        "fields": [
          "end",
          "number",
          "start",
          "text"
        ],
        "libraries": [
          "package:video_player/src/closed_caption_file.dart",
          "package:video_player/video_player.dart"
        ],
        "methods": [
          "Caption",
          "toString"
        ],
        "types": []
      },
      "ClosedCaption": {
        "fields": [
          "text",
          "textStyle"
        ],
        "libraries": [
          "package:video_player/video_player.dart"
        ],
        "methods": [
          "ClosedCaption",
          "build"
        ],
        "types": []
      },
      "ClosedCaptionFile": {
        "fields": [
          "get:captions"
        ],
        "libraries": [
          "package:video_player/src/closed_caption_file.dart",
          "package:video_player/video_player.dart"
        ],
        "methods": [],
        "types": [
          "Caption"
        ]
      },
      "SubRipCaptionFile": {
        "fields": [
          "fileContents",
          "get:captions"
        ],
        "libraries": [
          "package:video_player/src/closed_caption_file.dart",
          "package:video_player/src/sub_rip.dart",
          "package:video_player/video_player.dart"
        ],
        "methods": [
          "SubRipCaptionFile"
        ],
        "types": [
          "Caption",
          "ClosedCaptionFile"
        ]
      },
      "VideoPlayer": {
        "fields": [
          "controller"
        ],
        "libraries": [
          "package:video_player/video_player.dart"
        ],
        "methods": [
          "VideoPlayer",
          "createState"
        ],
        "types": [
          "VideoPlayerController"
        ]
      },
      "VideoPlayerController": {
        "fields": [
          "closedCaptionFile",
          "dataSource",
          "dataSourceType",
          "formatHint",
          "get:position",
          "get:textureId",
          "package",
          "videoPlayerOptions"
        ],
        "libraries": [
          "package:video_player/video_player.dart"
        ],
        "methods": [
          "asset",
          "dispose",
          "file",
          "initialize",
          "network",
          "pause",
          "play",
          "seekTo",
          "setLooping",
          "setPlaybackSpeed",
          "setVolume"
        ],
        "types": [
          "ClosedCaptionFile",
          "VideoPlayerValue"
        ]
      },
      "VideoPlayerValue": {
        "fields": [
          "buffered",
          "caption",
          "duration",
          "errorDescription",
          "get:aspectRatio",
          "get:hasError",
          "get:initialized",
          "isBuffering",
          "isLooping",
          "isPlaying",
          "playbackSpeed",
          "position",
          "size",
          "volume"
        ],
        "libraries": [
          "package:video_player/video_player.dart"
        ],
        "methods": [
          "VideoPlayerValue",
          "copyWith",
          "erroneous",
          "toString",
          "uninitialized"
        ],
        "types": [
          "Caption",
          "VideoPlayerValue"
        ]
      },
      "VideoProgressColors": {
        "fields": [
          "backgroundColor",
          "bufferedColor",
          "playedColor"
        ],
        "libraries": [
          "package:video_player/video_player.dart"
        ],
        "methods": [
          "VideoProgressColors"
        ],
        "types": []
      },
      "VideoProgressIndicator": {
        "fields": [
          "allowScrubbing",
          "colors",
          "controller",
          "padding"
        ],
        "libraries": [
          "package:video_player/video_player.dart"
        ],
        "methods": [
          "VideoProgressIndicator",
          "createState"
        ],
        "types": [
          "VideoPlayerController",
          "VideoProgressColors"
        ]
      }
    }
  },
  "collected_at": "2026-06-11T09:19:43Z",
  "package": "video_player",
  "pubdb_schema_version": 1,
  "source_fingerprint": {
    "basic_message_channels": [],
    "const_classes": [
      "Caption",
      "ClosedCaption"
    ],
    "digest": "c997cd420fc15fb1f26a1cd91ab2e60f9b41494ffd3254b604b7beaf894a617d",
    "event_channels": [],
    "ffi_symbols": [],
    "hierarchy_hash": "4df1906397e8ef8849cccb2cf5d0594caa722cf4918523f6d11a803099b81bbb",
    "method_channels": [],
    "strategy": "source-structural-v1",
    "string_literals": [
      "\n",
      " --> ",
      ",",
      ":",
      "Negative playback speeds are generally unsupported.",
      "Zero playback speed is generally unsupported. Consider using [pause].",
      "\\d\\d:\\d\\d:\\d\\d,\\d\\d\\d",
      "closed_caption_file.dart",
      "dart:async",
      "dart:convert",
      "dart:io",
      "package:flutter/foundation.dart",
      "package:flutter/material.dart",
      "package:flutter/services.dart",
      "package:meta/meta.dart",
      "package:video_player_platform_interface/video_player_platform_interface.dart",
      "src/closed_caption_file.dart",
      "sub_rip.dart"
    ]
  },
  "version": "1.0.0"
}
