{
  "api_surface": {
    "classes": {
      "TraceletFirebase": {
        "fields": [],
        "libraries": [
          "package:tracelet_firebase/src/tracelet_firebase_config.dart",
          "package:tracelet_firebase/tracelet_firebase.dart"
        ],
        "methods": [
          "buildHttpConfig",
          "configureTokenRefresh"
        ],
        "types": []
      }
    }
  },
  "collected_at": "2026-06-11T09:15:41Z",
  "package": "tracelet_firebase",
  "pubdb_schema_version": 1,
  "source_fingerprint": {
    "basic_message_channels": [],
    "const_classes": [],
    "digest": "7bf70e3286e50551326e197d9ad4b6e69f19f417f1bfa75ab1a66825afcc709a",
    "event_channels": [],
    "ffi_symbols": [],
    "hierarchy_hash": "a98a35808cbc4c6d470bd0119f657bea974b60922942ebc1c91ffaec863549ad",
    "method_channels": [],
    "strategy": "source-structural-v1",
    "string_literals": [
      "",
      "/$",
      "?auth=",
      "^/|/$",
      "error",
      "http",
      "package:firebase_auth/firebase_auth.dart",
      "package:firebase_core/firebase_core.dart",
      "package:tracelet/tracelet.dart",
      "src/tracelet_firebase_config.dart",
      "url",
      "vm:entry-point"
    ]
  },
  "version": "3.1.8"
}
