{
  "api_surface": {
    "classes": {
      "::": {
        "fields": [],
        "libraries": [
          "package:graphs/graphs.dart",
          "package:graphs/src/crawl_async.dart",
          "package:graphs/src/shortest_path.dart",
          "package:graphs/src/strongly_connected_components.dart"
        ],
        "methods": [
          "crawlAsync",
          "shortestPath",
          "shortestPaths",
          "stronglyConnectedComponents"
        ],
        "types": []
      }
    }
  },
  "collected_at": "2026-06-11T08:34:26Z",
  "package": "graphs",
  "pubdb_schema_version": 1,
  "source_fingerprint": {
    "basic_message_channels": [],
    "const_classes": [],
    "digest": "3d8b4be6102ea410d1d2fdd92b406d7b9e18424dc89c09c2b7bfb03a84f09e91",
    "event_channels": [],
    "ffi_symbols": [],
    "hierarchy_hash": "c742000dd4099733d1638c9904eb86d356aef266b2b5eb77996c6bfa5092e7fc",
    "method_channels": [],
    "strategy": "source-structural-v1",
    "string_literals": [
      "dart:async",
      "dart:collection",
      "dart:math",
      "src/crawl_async.dart",
      "src/shortest_path.dart",
      "src/strongly_connected_components.dart"
    ]
  },
  "version": "1.0.0"
}
