{
  "api_surface": {
    "classes": {
      "::": {
        "fields": [],
        "libraries": [
          "package:args/args.dart",
          "package:args/src/arg_results.dart",
          "package:args/src/option.dart",
          "package:args/src/usage.dart",
          "package:args/src/utils.dart"
        ],
        "methods": [
          "newArgResults",
          "newOption",
          "padRight"
        ],
        "types": [
          "ArgParser",
          "ArgResults",
          "Option",
          "OptionType"
        ]
      },
      "ArgParser": {
        "fields": [
          "allowTrailingOptions",
          "commands",
          "get:usage",
          "options"
        ],
        "libraries": [
          "package:args/args.dart",
          "package:args/src/arg_parser.dart"
        ],
        "methods": [
          "ArgParser",
          "addCommand",
          "addFlag",
          "addOption",
          "findByAbbreviation",
          "getDefault",
          "getUsage",
          "parse"
        ],
        "types": [
          "ArgParser",
          "ArgResults",
          "Option"
        ]
      },
      "ArgResults": {
        "fields": [
          "arguments",
          "command",
          "get:options",
          "name",
          "rest"
        ],
        "libraries": [
          "package:args/args.dart",
          "package:args/src/arg_results.dart"
        ],
        "methods": [
          "[]",
          "wasParsed"
        ],
        "types": [
          "ArgParser",
          "ArgResults"
        ]
      },
      "Command": {
        "fields": [
          "aliases",
          "argParser",
          "get:argResults",
          "get:description",
          "get:globalResults",
          "get:hidden",
          "get:invocation",
          "get:name",
          "get:parent",
          "get:runner",
          "get:subcommands",
          "get:usage",
          "takesArguments",
          "usageFooter"
        ],
        "libraries": [
          "package:args/command_runner.dart"
        ],
        "methods": [
          "Command",
          "addSubcommand",
          "printUsage",
          "run",
          "usageException"
        ],
        "types": [
          "ArgResults",
          "Command",
          "CommandRunner"
        ]
      },
      "CommandRunner": {
        "fields": [
          "argParser",
          "description",
          "executableName",
          "get:commands",
          "get:invocation",
          "get:usage",
          "usageFooter"
        ],
        "libraries": [
          "package:args/command_runner.dart"
        ],
        "methods": [
          "CommandRunner",
          "addCommand",
          "parse",
          "printUsage",
          "run",
          "runCommand",
          "usageException"
        ],
        "types": [
          "ArgResults",
          "Command"
        ]
      },
      "HelpCommand": {
        "fields": [
          "get:description",
          "get:invocation",
          "name"
        ],
        "libraries": [
          "package:args/src/help_command.dart"
        ],
        "methods": [
          "run"
        ],
        "types": [
          "Command"
        ]
      },
      "Option": {
        "fields": [
          "abbreviation",
          "allowed",
          "allowedHelp",
          "callback",
          "defaultValue",
          "get:isFlag",
          "get:isMultiple",
          "get:isSingle",
          "help",
          "hide",
          "name",
          "negatable",
          "type",
          "valueHelp"
        ],
        "libraries": [
          "package:args/args.dart",
          "package:args/src/option.dart"
        ],
        "methods": [
          "getOrDefault"
        ],
        "types": [
          "OptionType"
        ]
      },
      "OptionType": {
        "fields": [
          "FLAG",
          "MULTIPLE",
          "SINGLE",
          "name"
        ],
        "libraries": [
          "package:args/args.dart",
          "package:args/src/option.dart"
        ],
        "methods": [],
        "types": []
      },
      "Parser": {
        "fields": [
          "args",
          "commandName",
          "get:current",
          "grammar",
          "parent",
          "rest",
          "results"
        ],
        "libraries": [
          "package:args/src/parser.dart"
        ],
        "methods": [
          "Parser",
          "parse",
          "parseAbbreviation",
          "parseLongOption",
          "parseShortFlag",
          "parseSoloOption",
          "readNextArgAsValue",
          "setOption",
          "validate"
        ],
        "types": [
          "ArgParser",
          "ArgResults",
          "Option",
          "Parser"
        ]
      },
      "Usage": {
        "fields": [
          "NUM_COLUMNS",
          "args",
          "buffer",
          "columnWidths",
          "currentColumn",
          "newlinesNeeded",
          "numHelpLines"
        ],
        "libraries": [
          "package:args/src/usage.dart"
        ],
        "methods": [
          "Usage",
          "buildAllowedList",
          "calculateColumnWidths",
          "generate",
          "getAbbreviation",
          "getAllowedTitle",
          "getLongOption",
          "newline",
          "write",
          "writeLine"
        ],
        "types": [
          "ArgParser",
          "Option"
        ]
      },
      "UsageException": {
        "fields": [
          "message",
          "usage"
        ],
        "libraries": [
          "package:args/command_runner.dart",
          "package:args/src/usage_exception.dart"
        ],
        "methods": [
          "UsageException",
          "toString"
        ],
        "types": []
      }
    }
  },
  "collected_at": "2026-06-10T19:43:40Z",
  "package": "args",
  "pubdb_schema_version": 1,
  "source_fingerprint": {
    "basic_message_channels": [],
    "const_classes": [
      "OptionType"
    ],
    "digest": "0361fb6993953abcdecc3382b86059ec1cdfa951815ae48f937d647007f57214",
    "event_channels": [],
    "ffi_symbols": [],
    "hierarchy_hash": "98c5faf549babb11fd03a0d5be758fc60351b5b817fcceebd321a43d3e7c0a22",
    "method_channels": [],
    "strategy": "source-structural-v1",
    "string_literals": [
      "",
      "\n",
      " ",
      " (default)",
      "(defaults to on)",
      ", ",
      "-",
      "--",
      "../args.dart",
      "../command_runner.dart",
      "Abbreviation cannot be \"-\".",
      "Abbreviation is an invalid character.",
      "Abbreviation must be null or have length 1.",
      "Cannot specify arguments before a command.",
      "Name cannot be empty.",
      "OptionType.FLAG",
      "OptionType.MULTIPLE",
      "OptionType.SINGLE",
      "Print this usage information.",
      "Replaced with get usage. getUsage() will be removed in args 1.0",
      "[",
      "[ \\t\\r\\n\"'\\\\/]",
      "]",
      "^-([a-zA-Z0-9])$",
      "^-([a-zA-Z0-9]+)(.*)$",
      "^--([a-zA-Z\\-_0-9]+)(=(.*))?$",
      "arg_parser.dart",
      "arg_results.dart",
      "dart:async",
      "dart:collection",
      "dart:math",
      "h",
      "help",
      "no-",
      "option.dart",
      "package:collection/wrappers.dart",
      "parser.dart",
      "src/arg_parser.dart",
      "src/arg_results.dart",
      "src/help_command.dart",
      "src/option.dart",
      "src/usage_exception.dart",
      "src/utils.dart",
      "sub",
      "usage.dart"
    ]
  },
  "version": "0.12.2+3"
}
