{
  "api_surface": {
    "classes": {
      "::": {
        "fields": [],
        "libraries": [
          "package:google_maps_flutter/google_maps_flutter.dart"
        ],
        "methods": [],
        "types": [
          "GoogleMapController"
        ]
      },
      "AndroidGoogleMapsFlutter": {
        "fields": [
          "get:useAndroidViewSurface",
          "set:useAndroidViewSurface"
        ],
        "libraries": [
          "package:google_maps_flutter/google_maps_flutter.dart"
        ],
        "methods": [],
        "types": []
      },
      "GoogleMap": {
        "fields": [
          "buildingsEnabled",
          "cameraTargetBounds",
          "circles",
          "cloudMapId",
          "clusterManagers",
          "compassEnabled",
          "fortyFiveDegreeImageryEnabled",
          "gestureRecognizers",
          "groundOverlays",
          "heatmaps",
          "indoorViewEnabled",
          "initialCameraPosition",
          "layoutDirection",
          "liteModeEnabled",
          "mapToolbarEnabled",
          "mapType",
          "markers",
          "minMaxZoomPreference",
          "myLocationButtonEnabled",
          "myLocationEnabled",
          "onCameraIdle",
          "onCameraMove",
          "onCameraMoveStarted",
          "onLongPress",
          "onMapCreated",
          "onTap",
          "padding",
          "polygons",
          "polylines",
          "rotateGesturesEnabled",
          "scrollGesturesEnabled",
          "style",
          "tileOverlays",
          "tiltGesturesEnabled",
          "trafficEnabled",
          "webGestureHandling",
          "zoomControlsEnabled",
          "zoomGesturesEnabled"
        ],
        "libraries": [
          "package:google_maps_flutter/google_maps_flutter.dart"
        ],
        "methods": [
          "GoogleMap",
          "createState"
        ],
        "types": []
      },
      "GoogleMapController": {
        "fields": [
          "mapId"
        ],
        "libraries": [
          "package:google_maps_flutter/google_maps_flutter.dart"
        ],
        "methods": [
          "animateCamera",
          "clearTileCache",
          "dispose",
          "getLatLng",
          "getScreenCoordinate",
          "getStyleError",
          "getVisibleRegion",
          "getZoomLevel",
          "hideMarkerInfoWindow",
          "init",
          "isMarkerInfoWindowShown",
          "moveCamera",
          "setMapStyle",
          "showMarkerInfoWindow",
          "takeSnapshot"
        ],
        "types": [
          "GoogleMapController"
        ]
      },
      "UnknownMapObjectIdError": {
        "fields": [
          "context",
          "objectId",
          "objectType"
        ],
        "libraries": [
          "package:google_maps_flutter/google_maps_flutter.dart"
        ],
        "methods": [
          "UnknownMapObjectIdError",
          "toString"
        ],
        "types": []
      }
    }
  },
  "collected_at": "2026-06-11T08:33:48Z",
  "package": "google_maps_flutter",
  "pubdb_schema_version": 1,
  "source_fingerprint": {
    "basic_message_channels": [],
    "const_classes": [
      "GoogleMap"
    ],
    "digest": "5cffe9c65c499b23a045be9201dfe3d496953f51250cea06870177d8d1c4de04",
    "event_channels": [],
    "ffi_symbols": [],
    "hierarchy_hash": "14646368c923d410d5d9c0a69bdeffb7cef675bbaeff5fcad3e930f5a0c2ed4d",
    "method_channels": [],
    "strategy": "source-structural-v1",
    "string_literals": [
      "",
      "../google_maps_flutter.dart",
      "InfoWindow onTap",
      "See https://pub.dev/packages/google_maps_flutter_android#display-mode",
      "Use GoogleMap.style instead.",
      "clusterManager",
      "dart:async",
      "groundOverlay",
      "marker",
      "onClusterTap",
      "onDrag",
      "onDragEnd",
      "onDragStart",
      "onTap",
      "package:flutter/foundation.dart",
      "package:flutter/gestures.dart",
      "package:flutter/material.dart",
      "package:google_maps_flutter_android/google_maps_flutter_android.dart",
      "package:google_maps_flutter_platform_interface/google_maps_flutter_platform_interface.dart",
      "polygon",
      "polyline",
      "src/controller.dart",
      "src/google_map.dart"
    ]
  },
  "version": "2.11.0"
}
