{
  "api_surface": {
    "classes": {
      "::": {
        "fields": [],
        "libraries": [
          "package:firebase_messaging/firebase_messaging.dart"
        ],
        "methods": [],
        "types": []
      },
      "FirebaseMessaging": {
        "fields": [
          "get:onIosSettingsRegistered",
          "get:onTokenRefresh"
        ],
        "libraries": [
          "package:firebase_messaging/firebase_messaging.dart"
        ],
        "methods": [
          "FirebaseMessaging",
          "configure",
          "getToken",
          "private",
          "requestNotificationPermissions",
          "subscribeToTopic",
          "unsubscribeFromTopic"
        ],
        "types": [
          "FirebaseMessaging",
          "IosNotificationSettings"
        ]
      },
      "IosNotificationSettings": {
        "fields": [
          "alert",
          "badge",
          "sound"
        ],
        "libraries": [
          "package:firebase_messaging/firebase_messaging.dart"
        ],
        "methods": [
          "IosNotificationSettings",
          "toMap",
          "toString"
        ],
        "types": []
      }
    }
  },
  "collected_at": "2026-06-11T07:20:50Z",
  "package": "firebase_messaging",
  "pubdb_schema_version": 1,
  "source_fingerprint": {
    "basic_message_channels": [],
    "const_classes": [
      "IosNotificationSettings"
    ],
    "digest": "4c483a2d213e1bb44bc571a55abad2676c63a7d77ba8ef699b2d535a093cd6d5",
    "event_channels": [],
    "ffi_symbols": [],
    "hierarchy_hash": "8bf9a36c04ad78729e92b68d0f6bdc5e4985a01983123e1900d4c92a1a9c6e4a",
    "method_channels": [
      "firebase_messaging"
    ],
    "strategy": "source-structural-v1",
    "string_literals": [
      "Unrecognized JSON message",
      "alert",
      "badge",
      "configure",
      "dart:async",
      "firebase_messaging",
      "onIosSettingsRegistered",
      "onLaunch",
      "onMessage",
      "onResume",
      "onToken",
      "package:flutter/services.dart",
      "package:meta/meta.dart",
      "package:platform/platform.dart",
      "requestNotificationPermissions",
      "sound",
      "subscribeToTopic",
      "unsubscribeFromTopic"
    ]
  },
  "version": "0.0.1"
}
