{
  "api_surface": {
    "classes": {
      "::": {
        "fields": [],
        "libraries": [
          "package:hooks_riverpod/hooks_riverpod.dart",
          "package:hooks_riverpod/src/framework.dart"
        ],
        "methods": [
          "useProvider"
        ],
        "types": []
      }
    }
  },
  "collected_at": "2026-06-11T08:35:11Z",
  "package": "hooks_riverpod",
  "pubdb_schema_version": 1,
  "source_fingerprint": {
    "basic_message_channels": [],
    "const_classes": [
      "_ProviderHook"
    ],
    "digest": "c059a1dbabafb71a3c6826e3e93a09c997b98d2f3f97569f8fb1a399538df204",
    "event_channels": [],
    "ffi_symbols": [],
    "hierarchy_hash": "df056b0e1a9b20fa5ea17b5edc9dba820ab2bcf437253df046582444032256f2",
    "method_channels": [],
    "strategy": "source-structural-v1",
    "string_literals": [
      "The provider listened cannot change",
      "framework.dart",
      "package:flutter/widgets.dart",
      "package:flutter_hooks/flutter_hooks.dart",
      "package:flutter_riverpod/flutter_riverpod.dart",
      "package:flutter_riverpod/src/internals.dart",
      "src/framework.dart",
      "useProvider was updated from `useProvider(provider.select(...)) to useProvider(provider), which is unsupported",
      "use_provider.dart"
    ]
  },
  "version": "0.6.0-dev"
}
