{
  "api_surface": {
    "classes": {
      "Intercom": {
        "fields": [
          "get:instance"
        ],
        "libraries": [
          "package:intercom_flutter/intercom_flutter.dart"
        ],
        "methods": [
          "displayArticle",
          "displayCarousel",
          "displayConversation",
          "displayHelpCenter",
          "displayHelpCenterCollections",
          "displayHome",
          "displayMessageComposer",
          "displayMessages",
          "displayMessenger",
          "displaySurvey",
          "displayTickets",
          "fetchLoggedInUserAttributes",
          "getUnreadStream",
          "handlePush",
          "handlePushMessage",
          "hideMessenger",
          "initialize",
          "isIntercomPush",
          "isUserLoggedIn",
          "logEvent",
          "loginIdentifiedUser",
          "loginUnidentifiedUser",
          "logout",
          "sendTokenToIntercom",
          "setAuthTokens",
          "setBottomPadding",
          "setInAppMessagesVisibility",
          "setLauncherVisibility",
          "setThemeMode",
          "setUserHash",
          "setUserJwt",
          "unreadConversationCount",
          "updateUser"
        ],
        "types": [
          "Intercom"
        ]
      }
    }
  },
  "collected_at": "2026-06-11T08:42:06Z",
  "package": "intercom_flutter",
  "pubdb_schema_version": 1,
  "source_fingerprint": {
    "basic_message_channels": [],
    "const_classes": [],
    "digest": "4c05d10cf750a5fe73c3b8b91c0d059853c206a079f37b0e3f726a9deab7c9e3",
    "event_channels": [],
    "ffi_symbols": [],
    "hierarchy_hash": "f247e36c9d0459614d532adb9e6d446214cad848323f64a7620b9b7af73766e3",
    "method_channels": [],
    "strategy": "source-structural-v1",
    "string_literals": [
      "Calling this API is no longer required. Intercom will directly open the chat screen when a push notification is clicked.",
      "dart:async",
      "package:intercom_flutter_platform_interface/enumeral.dart",
      "package:intercom_flutter_platform_interface/intercom_flutter_platform_interface.dart",
      "package:intercom_flutter_platform_interface/intercom_status_callback.dart"
    ]
  },
  "version": "9.5.3"
}
