{
  "api_surface": {
    "classes": {
      "::": {
        "fields": [
          "HEAP_ZERO_MEMORY",
          "calloc",
          "malloc",
          "posixCalloc",
          "posixFree",
          "posixMalloc",
          "processHeap",
          "stdlib",
          "winGetProcessHeap",
          "winHeapAlloc",
          "winHeapFree"
        ],
        "libraries": [
          "package:ffi/ffi.dart",
          "package:ffi/src/allocation.dart"
        ],
        "methods": [],
        "types": []
      },
      "StringUtf16Pointer": {
        "fields": [],
        "libraries": [
          "package:ffi/ffi.dart",
          "package:ffi/src/utf16.dart"
        ],
        "methods": [
          "toNativeUtf16"
        ],
        "types": [
          "Utf16"
        ]
      },
      "StringUtf8Pointer": {
        "fields": [],
        "libraries": [
          "package:ffi/ffi.dart",
          "package:ffi/src/utf8.dart"
        ],
        "methods": [
          "toNativeUtf8"
        ],
        "types": [
          "Utf8"
        ]
      },
      "Utf16": {
        "fields": [],
        "libraries": [
          "package:ffi/ffi.dart",
          "package:ffi/src/utf16.dart"
        ],
        "methods": [],
        "types": []
      },
      "Utf16Pointer": {
        "fields": [
          "get:length"
        ],
        "libraries": [
          "package:ffi/ffi.dart",
          "package:ffi/src/utf16.dart"
        ],
        "methods": [
          "toDartString"
        ],
        "types": [
          "Utf16"
        ]
      },
      "Utf8": {
        "fields": [],
        "libraries": [
          "package:ffi/ffi.dart",
          "package:ffi/src/utf8.dart"
        ],
        "methods": [],
        "types": []
      },
      "Utf8Pointer": {
        "fields": [
          "get:length"
        ],
        "libraries": [
          "package:ffi/ffi.dart",
          "package:ffi/src/utf8.dart"
        ],
        "methods": [
          "toDartString"
        ],
        "types": [
          "Utf8"
        ]
      }
    }
  },
  "collected_at": "2026-06-11T07:18:35Z",
  "package": "ffi",
  "pubdb_schema_version": 1,
  "source_fingerprint": {
    "basic_message_channels": [],
    "const_classes": [
      "_CallocAllocator",
      "_MallocAllocator"
    ],
    "digest": "3cf001a73ffa1a74701a7eff409dd6aafd3b871ad8322a9feebd6dc699c7cd6f",
    "event_channels": [],
    "ffi_symbols": [
      "GetProcessHeap",
      "HeapAlloc",
      "HeapFree",
      "calloc",
      "free",
      "malloc"
    ],
    "hierarchy_hash": "243dccee44a195bf3ebc1020bfddd9f8f9a597fd0ee136bcb6205b0edc770abe",
    "method_channels": [],
    "strategy": "source-structural-v1",
    "string_literals": [
      "GetProcessHeap",
      "HeapAlloc",
      "HeapFree",
      "calloc",
      "dart:convert",
      "dart:ffi",
      "dart:io",
      "dart:typed_data",
      "free",
      "kernel32.dll",
      "length",
      "malloc",
      "package:ffi/ffi.dart",
      "src/allocation.dart",
      "src/utf16.dart",
      "src/utf8.dart"
    ]
  },
  "version": "1.0.0"
}
