{
  "api_surface": {
    "classes": {
      "::": {
        "fields": [
          "get:timeDilation"
        ],
        "libraries": [
          "package:cached_network_image_ce/cached_network_image.dart",
          "package:cached_network_image_ce/src/cache/default_cache_manager.dart",
          "package:cached_network_image_ce/src/cached_image_widget.dart",
          "package:cached_network_image_ce/src/image_provider/multi_image_stream_completer.dart"
        ],
        "methods": [],
        "types": []
      },
      "CacheEntryMetadata": {
        "fields": [
          "eTag",
          "length",
          "relativePath",
          "url",
          "validTill"
        ],
        "libraries": [
          "package:cached_network_image_ce/cached_network_image.dart",
          "package:cached_network_image_ce/src/cache/cache_entry_metadata.dart",
          "package:cached_network_image_ce/src/cache/default_cache_manager.dart",
          "package:cached_network_image_ce/src/cache/default_cache_manager_factory.dart",
          "package:cached_network_image_ce/src/cache/default_cache_manager_stub.dart",
          "package:cached_network_image_ce/src/cache/default_cache_manager_web.dart"
        ],
        "methods": [
          "CacheEntryMetadata",
          "fromMap",
          "toMap"
        ],
        "types": []
      },
      "CachedNetworkImage": {
        "fields": [
          "alignment",
          "cacheKey",
          "cacheManager",
          "color",
          "colorBlendMode",
          "disablePlaceholderOnCacheHit",
          "errorBuilder",
          "errorListener",
          "errorWidget",
          "fadeInCurve",
          "fadeInDuration",
          "fadeOutCurve",
          "fadeOutDuration",
          "filterQuality",
          "fit",
          "get:logLevel",
          "height",
          "httpHeaders",
          "imageBuilder",
          "imageRenderMethodForWeb",
          "imageUrl",
          "matchTextDirection",
          "maxHeightDiskCache",
          "maxWidthDiskCache",
          "memCacheHeight",
          "memCacheWidth",
          "placeholder",
          "placeholderFadeInDuration",
          "progressIndicatorBuilder",
          "repeat",
          "scale",
          "set:logLevel",
          "unsupportedImageBuilder",
          "useOldImageOnUrlChange",
          "width"
        ],
        "libraries": [
          "package:cached_network_image_ce/cached_network_image.dart",
          "package:cached_network_image_ce/src/cached_image_widget.dart"
        ],
        "methods": [
          "CachedNetworkImage",
          "createState",
          "evictFromCache"
        ],
        "types": [
          "CachedNetworkImage"
        ]
      },
      "CachedNetworkImageProvider": {
        "fields": [
          "cacheKey",
          "cacheManager",
          "defaultCacheManager",
          "errorListener",
          "get:hashCode",
          "headers",
          "imageRenderMethodForWeb",
          "maxHeight",
          "maxWidth",
          "scale",
          "url"
        ],
        "libraries": [
          "package:cached_network_image_ce/cached_network_image.dart",
          "package:cached_network_image_ce/src/image_provider/cached_network_image_provider.dart"
        ],
        "methods": [
          "==",
          "CachedNetworkImageProvider",
          "loadBuffer",
          "loadImage",
          "obtainKey",
          "toString"
        ],
        "types": [
          "CachedNetworkImageProvider"
        ]
      },
      "DefaultCacheManager": {
        "fields": [
          "connectionParameters",
          "maxNrOfCacheObjects",
          "stalePeriod"
        ],
        "libraries": [
          "package:cached_network_image_ce/cached_network_image.dart",
          "package:cached_network_image_ce/src/cache/default_cache_manager.dart",
          "package:cached_network_image_ce/src/cache/default_cache_manager_factory.dart",
          "package:cached_network_image_ce/src/cache/default_cache_manager_stub.dart",
          "package:cached_network_image_ce/src/cache/default_cache_manager_web.dart"
        ],
        "methods": [
          "DefaultCacheManager",
          "dispose",
          "emptyCache",
          "getFileFromCache",
          "getFileStream",
          "getImageFile",
          "putFile",
          "removeFile"
        ],
        "types": []
      },
      "ImageLoader": {
        "fields": [],
        "libraries": [
          "package:cached_network_image_ce/src/image_provider/_image_loader.dart"
        ],
        "methods": [
          "loadBufferAsync",
          "loadImageAsync"
        ],
        "types": [
          "ImageLoader"
        ]
      },
      "MultiImageStreamCompleter": {
        "fields": [],
        "libraries": [
          "package:cached_network_image_ce/cached_network_image.dart",
          "package:cached_network_image_ce/src/image_provider/multi_image_stream_completer.dart"
        ],
        "methods": [
          "MultiImageStreamCompleter",
          "addListener",
          "keepAlive",
          "removeListener"
        ],
        "types": []
      }
    }
  },
  "collected_at": "2026-06-11T07:15:29Z",
  "package": "cached_network_image_ce",
  "pubdb_schema_version": 1,
  "source_fingerprint": {
    "basic_message_channels": [],
    "const_classes": [
      "CachedNetworkImage",
      "CachedNetworkImageProvider"
    ],
    "digest": "a2ddfd87182a15c71450e5fb2e3d702c9668860e6e110d0926e0f6d125278c10",
    "event_channels": [],
    "ffi_symbols": [],
    "hierarchy_hash": "2c9193f502a924f0e4f7562e51d2b595fc6024f15fc61bdad2820b8dff3446d8",
    "method_channels": [],
    "strategy": "source-structural-v1",
    "string_literals": [
      "",
      ".",
      "CachedNetworkImageProvider.loadBuffer fallback to addListener",
      "CachedNetworkImageProvider.loadImage fallback to addListener",
      "DefaultCacheManager is not supported on this platform.",
      "GET",
      "Image key",
      "Image provider",
      "To resize the image with a CacheManager the CacheManager needs to be an ImageCacheManager. maxWidth and maxHeight will be ignored when a normal CacheManager is used.",
      "Unsupported platform",
      "Use errorBuilder instead.",
      "Use loadImageAsync instead",
      "Warning: Using errorListener with Flutter < 3.16 causes memory leaks. Please upgrade Flutter or avoid using errorListener.",
      "_image_loader.dart",
      "_loadBufferAsync is deprecated, use _loadImageAsync instead",
      "cache_entry_metadata.dart",
      "cached_network_image",
      "cached_network_image_cache",
      "cached_network_image_ce",
      "cached_network_image_data",
      "cur",
      "dart:async",
      "dart:io",
      "dart:math",
      "dart:typed_data",
      "dart:ui",
      "default_cache_manager.dart",
      "default_cache_manager_stub.dart",
      "default_cache_manager_web.dart",
      "eTag",
      "etag",
      "file",
      "hive",
      "ico",
      "jpeg",
      "jpg",
      "length",
      "loadBuffer is deprecated, use loadImage instead",
      "loading an image",
      "package:cached_network_image_ce/cached_network_image.dart",
      "package:cached_network_image_platform_interface_ce/cached_network_image_platform_interface_ce.dart",
      "package:cached_network_image_web_ce/cached_network_image_web_ce.dart",
      "package:file/file.dart",
      "package:file/local.dart",
      "package:file/memory.dart",
      "package:flutter/foundation.dart",
      "package:flutter/material.dart",
      "package:flutter/painting.dart",
      "package:flutter/scheduler.dart",
      "package:flutter/widgets.dart",
      "package:hive_ce/hive.dart",
      "package:hive_ce/src/hive_impl.dart",
      "package:http/http.dart",
      "package:octo_image/octo_image.dart",
      "package:path/path.dart",
      "package:path_provider/path_provider.dart",
      "png",
      "relativePath",
      "resized",
      "resolving an image codec",
      "resolving an image frame",
      "src/cache/default_cache_manager_factory.dart",
      "src/cached_image_widget.dart",
      "src/image_provider/cached_network_image_provider.dart",
      "src/image_provider/multi_image_stream_completer.dart",
      "tga",
      "url",
      "validTill"
    ]
  },
  "version": "4.6.2"
}
