{
  "api_surface": {
    "classes": {
      "::": {
        "fields": [],
        "libraries": [
          "package:coverage/coverage.dart",
          "package:coverage/src/devtools.dart",
          "package:coverage/src/hitmap.dart",
          "package:coverage/src/util.dart"
        ],
        "methods": [
          "createHitmap",
          "mergeHitmaps",
          "parseCoverage",
          "retry"
        ],
        "types": []
      },
      "AllocationProfile": {
        "fields": [
          "id"
        ],
        "libraries": [
          "package:coverage/src/devtools.dart"
        ],
        "methods": [
          "AllocationProfile",
          "fromJson"
        ],
        "types": []
      },
      "CodeCoverage": {
        "fields": [
          "coverage",
          "id"
        ],
        "libraries": [
          "package:coverage/src/devtools.dart"
        ],
        "methods": [
          "CodeCoverage",
          "fromJson"
        ],
        "types": []
      },
      "Formatter": {
        "fields": [],
        "libraries": [
          "package:coverage/coverage.dart",
          "package:coverage/src/formatter.dart"
        ],
        "methods": [
          "format"
        ],
        "types": []
      },
      "Isolate": {
        "fields": [
          "get:paused",
          "id",
          "name",
          "pauseEvent",
          "pauseOnExit"
        ],
        "libraries": [
          "package:coverage/src/devtools.dart"
        ],
        "methods": [
          "Isolate",
          "fromJson"
        ],
        "types": []
      },
      "IsolateRef": {
        "fields": [
          "id",
          "name"
        ],
        "libraries": [
          "package:coverage/src/devtools.dart"
        ],
        "methods": [
          "IsolateRef",
          "fromJson"
        ],
        "types": []
      },
      "LcovFormatter": {
        "fields": [
          "resolver"
        ],
        "libraries": [
          "package:coverage/coverage.dart",
          "package:coverage/src/formatter.dart"
        ],
        "methods": [
          "LcovFormatter",
          "format"
        ],
        "types": [
          "Formatter",
          "Resolver"
        ]
      },
      "Loader": {
        "fields": [
          "failed"
        ],
        "libraries": [
          "package:coverage/coverage.dart",
          "package:coverage/src/resolver.dart"
        ],
        "methods": [
          "load"
        ],
        "types": []
      },
      "PrettyPrintFormatter": {
        "fields": [
          "loader",
          "resolver"
        ],
        "libraries": [
          "package:coverage/coverage.dart",
          "package:coverage/src/formatter.dart"
        ],
        "methods": [
          "PrettyPrintFormatter",
          "format"
        ],
        "types": [
          "Formatter",
          "Loader",
          "Resolver"
        ]
      },
      "Resolver": {
        "fields": [
          "DART_PREFIX",
          "FILE_PREFIX",
          "HTTP_PREFIX",
          "PACKAGE_PREFIX",
          "failed",
          "pkgRoot",
          "sdkRoot"
        ],
        "libraries": [
          "package:coverage/coverage.dart",
          "package:coverage/src/resolver.dart"
        ],
        "methods": [
          "Resolver",
          "resolve",
          "resolveSymbolicLinks"
        ],
        "types": []
      },
      "VM": {
        "fields": [
          "hostCPU",
          "id",
          "isolates",
          "pid",
          "targetCPU",
          "version"
        ],
        "libraries": [
          "package:coverage/src/devtools.dart"
        ],
        "methods": [
          "VM",
          "fromJson"
        ],
        "types": [
          "IsolateRef"
        ]
      },
      "VMService": {
        "fields": [],
        "libraries": [
          "package:coverage/src/devtools.dart"
        ],
        "methods": [
          "close",
          "connect",
          "connectToDevtools",
          "connectToVM",
          "connectToVMWebsocket",
          "getAllocationProfile",
          "getCoverage",
          "getIsolate",
          "getVM",
          "resume"
        ],
        "types": [
          "AllocationProfile",
          "Isolate",
          "VM",
          "VMService"
        ]
      }
    }
  },
  "collected_at": "2026-06-11T07:16:36Z",
  "package": "coverage",
  "pubdb_schema_version": 1,
  "source_fingerprint": {
    "basic_message_channels": [],
    "const_classes": [],
    "digest": "365585011cfd30514abbae3b8a3d24c5eeec0e0b198beb236ca5ff66cd00daf0",
    "event_channels": [],
    "ffi_symbols": [],
    "hierarchy_hash": "7eb97d4f4bd4d9636197ddb4e49b3ee60cb7a2420faaa0782214b91cbef59ce7",
    "method_channels": [],
    "strategy": "source-structural-v1",
    "string_literals": [
      "",
      " ",
      "       ",
      "-",
      "-patch",
      "/",
      "Connecting to VM via Chromium remote debugging protocol",
      "Connecting to VM via HTTP GET protocol",
      "Connecting to VM via HTTP websocket protocol",
      "Dart.observatoryData",
      "Dart.observatoryQuery",
      "Error splitting",
      "Failed to pair response with request",
      "More than one open page. Defaulting to the first one.",
      "No open pages",
      "Unable to obtain debugger URL",
      "^1\\.[4-8]\\.",
      "_",
      "coverage",
      "coverage.src.devtools",
      "dart:",
      "dart:async",
      "dart:convert",
      "dart:io",
      "dart:isolate",
      "data",
      "end_of_record\n",
      "file://",
      "full",
      "gc",
      "getAllocationProfile",
      "getCoverage",
      "getIsolate",
      "getVM",
      "hits",
      "hostCPU",
      "http",
      "http://",
      "id",
      "isolateId",
      "isolates",
      "method",
      "name",
      "package:",
      "package:http/http.dart",
      "package:logging/logging.dart",
      "package:path/path.dart",
      "page",
      "params",
      "pauseEvent",
      "pauseOnExit",
      "pid",
      "query",
      "reset",
      "resolver.dart",
      "response",
      "result",
      "resume",
      "source",
      "src/formatter.dart",
      "src/hitmap.dart",
      "src/resolver.dart",
      "targetCPU",
      "targetId",
      "type",
      "version",
      "vm",
      "webSocketDebuggerUrl"
    ]
  },
  "version": "0.6.3"
}
