{
  "api_surface": {
    "classes": {
      "::": {
        "fields": [
          "nonToken",
          "token",
          "webSocketGUID",
          "whitespace"
        ],
        "libraries": [
          "package:http_parser/http_parser.dart",
          "package:http_parser/src/copy/web_socket_impl.dart",
          "package:http_parser/src/http_date.dart",
          "package:http_parser/src/scan.dart",
          "package:http_parser/src/utils.dart"
        ],
        "methods": [
          "expectQuotedString",
          "formatHttpDate",
          "parseHttpDate",
          "parseList",
          "wrapFormatException"
        ],
        "types": []
      },
      "AuthenticationChallenge": {
        "fields": [
          "parameters",
          "scheme"
        ],
        "libraries": [
          "package:http_parser/http_parser.dart",
          "package:http_parser/src/authentication_challenge.dart"
        ],
        "methods": [
          "AuthenticationChallenge",
          "parse",
          "parseHeader"
        ],
        "types": [
          "AuthenticationChallenge"
        ]
      },
      "BytesBuilder": {
        "fields": [
          "get:isEmpty",
          "get:isNotEmpty",
          "get:length"
        ],
        "libraries": [
          "package:http_parser/src/copy/bytes_builder.dart"
        ],
        "methods": [
          "BytesBuilder",
          "add",
          "addByte",
          "clear",
          "takeBytes",
          "toBytes"
        ],
        "types": []
      },
      "CaseInsensitiveMap": {
        "fields": [],
        "libraries": [
          "package:http_parser/http_parser.dart",
          "package:http_parser/src/case_insensitive_map.dart"
        ],
        "methods": [
          "CaseInsensitiveMap",
          "from"
        ],
        "types": []
      },
      "CompatibleWebSocket": {
        "fields": [
          "get:closeCode",
          "get:closeReason",
          "pingInterval"
        ],
        "libraries": [
          "package:http_parser/http_parser.dart",
          "package:http_parser/src/web_socket.dart"
        ],
        "methods": [
          "CompatibleWebSocket",
          "close",
          "signKey"
        ],
        "types": []
      },
      "CompatibleWebSocketException": {
        "fields": [
          "message"
        ],
        "libraries": [
          "package:http_parser/http_parser.dart",
          "package:http_parser/src/web_socket.dart"
        ],
        "methods": [
          "CompatibleWebSocketException",
          "toString"
        ],
        "types": []
      },
      "DataUri": {
        "fields": [
          "data",
          "get:authority",
          "get:declaredEncoding",
          "get:fragment",
          "get:hasAbsolutePath",
          "get:hasAuthority",
          "get:hasEmptyPath",
          "get:hasFragment",
          "get:hasPort",
          "get:hasQuery",
          "get:hasScheme",
          "get:hashCode",
          "get:host",
          "get:isAbsolute",
          "get:origin",
          "get:path",
          "get:pathSegments",
          "get:port",
          "get:query",
          "get:queryParameters",
          "get:scheme",
          "get:userInfo",
          "mediaType"
        ],
        "libraries": [
          "package:http_parser/http_parser.dart",
          "package:http_parser/src/data_uri.dart"
        ],
        "methods": [
          "==",
          "dataAsString",
          "decode",
          "encode",
          "encodeString",
          "normalizePath",
          "removeFragment",
          "replace",
          "resolve",
          "resolveUri",
          "toFilePath",
          "toString"
        ],
        "types": [
          "MediaType"
        ]
      },
      "MediaType": {
        "fields": [
          "get:mimeType",
          "parameters",
          "subtype",
          "type"
        ],
        "libraries": [
          "package:http_parser/http_parser.dart",
          "package:http_parser/src/media_type.dart"
        ],
        "methods": [
          "MediaType",
          "change",
          "parse",
          "toString"
        ],
        "types": [
          "MediaType"
        ]
      },
      "StreamSinkImpl": {
        "fields": [
          "get:done"
        ],
        "libraries": [
          "package:http_parser/src/copy/io_sink.dart"
        ],
        "methods": [
          "StreamSinkImpl",
          "add",
          "addError",
          "addStream",
          "close",
          "flush"
        ],
        "types": []
      },
      "WebSocket": {
        "fields": [
          "CLOSED",
          "CLOSING",
          "CONNECTING",
          "OPEN"
        ],
        "libraries": [
          "package:http_parser/src/copy/web_socket.dart"
        ],
        "methods": [],
        "types": []
      },
      "WebSocketImpl": {
        "fields": [
          "get:closeCode",
          "get:closeReason",
          "get:done",
          "get:extensions",
          "get:pingInterval",
          "get:readyState",
          "protocol",
          "set:pingInterval"
        ],
        "libraries": [
          "package:http_parser/src/copy/web_socket_impl.dart"
        ],
        "methods": [
          "add",
          "addError",
          "addStream",
          "close",
          "fromSocket",
          "listen"
        ],
        "types": [
          "CompatibleWebSocket",
          "WebSocketImpl"
        ]
      },
      "WebSocketStatus": {
        "fields": [
          "ABNORMAL_CLOSURE",
          "GOING_AWAY",
          "INTERNAL_SERVER_ERROR",
          "INVALID_FRAME_PAYLOAD_DATA",
          "MESSAGE_TOO_BIG",
          "MISSING_MANDATORY_EXTENSION",
          "NORMAL_CLOSURE",
          "NO_STATUS_RECEIVED",
          "POLICY_VIOLATION",
          "PROTOCOL_ERROR",
          "RESERVED_1004",
          "RESERVED_1015",
          "UNSUPPORTED_DATA"
        ],
        "libraries": [
          "package:http_parser/src/copy/web_socket.dart"
        ],
        "methods": [],
        "types": []
      }
    }
  },
  "collected_at": "2026-06-11T08:35:58Z",
  "package": "http_parser",
  "pubdb_schema_version": 1,
  "source_fingerprint": {
    "basic_message_channels": [],
    "const_classes": [],
    "digest": "dda4abf4163c742d53c4a90540fe607babddbcdfceaa75de7cae5bf0ddc834e4",
    "event_channels": [],
    "ffi_symbols": [],
    "hierarchy_hash": "2e82de6a1c63ab5f33da250f6497b2122fd03a933bfcc4542d2b5a0b7708f6fe",
    "method_channels": [],
    "strategy": "source-structural-v1",
    "string_literals": [
      "",
      " ",
      " 0",
      " GMT",
      "\"",
      "\" \" or \"=\"",
      "\"(?:[^\"\\x00-\\x1F\\x7F]|\\\\.)*\"",
      "#",
      "(?:(?:%0D%0A)?(?:%20|%09)+)*",
      "(?:\\r\\n)?[ \\t]+",
      ",",
      ", ",
      "-",
      "../web_socket.dart",
      "/",
      "0",
      "258EAFA5-E914-47DA-95CA-C5AB0DC85B11",
      ":",
      ":0",
      ";",
      ";base64,",
      "=",
      "Apr",
      "Aug",
      "Can only decode a data: URI.",
      "CompatibleWebSocketException",
      "Data on closed connection",
      "Data on failed connection",
      "Dec",
      "Feb",
      "Fri",
      "HTTP date",
      "If stream isn't also a StreamSink, sink must be passed explicitly.",
      "Invalid token.",
      "Jan",
      "Jan|Feb|Mar|Apr|May|Jun|Jul|Aug|Sep|Oct|Nov|Dec",
      "Jul",
      "Jun",
      "Mar",
      "May",
      "Mon",
      "Monday|Tuesday|Wednesday|Thursday|Friday|Saturday|Sunday",
      "Mon|Tue|Wed|Thu|Fri|Sat|Sun",
      "Must be a String or a Uri.",
      "Nov",
      "Oct",
      "Protocol error",
      "Received masked frame from server",
      "Received unmasked frame from client",
      "Sat",
      "Sep",
      "StreamSink is already bound to a stream",
      "StreamSink is bound to a stream",
      "StreamSink is closed",
      "Sun",
      "Thu",
      "Tue",
      "US-ASCII",
      "WebSocket transformer already used",
      "WebSocket transformer already used.",
      "Wed",
      "You may not pass both [subtype] and [mimeType].",
      "You may not pass both [type] and [mimeType].",
      "[\"\\x00-\\x1F\\x7F]",
      "[()<>@,;:\"\\\\/\\[\\]?={} \\t\\x00-\\x1F\\x7F]",
      "[^()<>@,;:\"\\\\/[\\]?={} \\t\\x00-\\x1F\\x7F]+",
      "\\",
      "\\\\(.)",
      "\\d+",
      "a token",
      "a token or a quoted string",
      "authentication challenge",
      "authentication header",
      "base64",
      "bytes_builder.dart",
      "case_insensitive_map.dart",
      "charset",
      "copy/web_socket_impl.dart",
      "dart:async",
      "dart:collection",
      "dart:convert",
      "dart:math",
      "dart:typed_data",
      "data",
      "data URI",
      "data:",
      "hours may not be greater than 24.",
      "io_sink.dart",
      "media type",
      "media_type.dart",
      "minutes may not be greater than 60.",
      "package:collection/collection.dart",
      "package:convert/convert.dart",
      "package:crypto/crypto.dart",
      "package:source_span/source_span.dart",
      "package:string_scanner/string_scanner.dart",
      "plain",
      "quoted string",
      "scan.dart",
      "seconds may not be greater than 60.",
      "src/authentication_challenge.dart",
      "src/case_insensitive_map.dart",
      "src/data_uri.dart",
      "src/http_date.dart",
      "src/media_type.dart",
      "src/web_socket.dart",
      "text",
      "uri",
      "utf-8",
      "utils.dart",
      "web_socket.dart"
    ]
  },
  "version": "1.1.0"
}
